# name: test/sql/dml/update.slt
# description: Test update
# group: [dml, update]

statement ok
DROP TABLE IF EXISTS products;

# Parse only support
statement ok
CREATE TABLE products (product_no integer, price integer);

# insert data
query I
INSERT INTO products VALUES (1, 2), (3, 4);
----

query I
INSERT INTO products VALUES (5, 6), (7, 8);
----

query II rowsort
SELECT * FROM products;
----
1 2
3 4
5 6
7 8

query II
SELECT count(*) FROM products;
----
4

statement ok
UPDATE products SET price=100 WHERE product_no = 3;

query II rowsort
SELECT * FROM products;
----
1 2
3 100
5 6
7 8

query II
SELECT count(*) FROM products;
----
4


statement ok
UPDATE products SET price=price+3 WHERE product_no = 1 OR product_no = 5;

query II rowsort
SELECT * FROM products;
----
1 5
3 100
5 9
7 8

statement ok
CREATE index idx1 on products(product_no);

statement ok
UPDATE products SET price=200 WHERE product_no = 3;

query II rowsort
SELECT * FROM products;
----
1 5
3 200
5 9
7 8

query II
SELECT count(*) FROM products;
----
4

statement ok
UPDATE products SET price=price+3 WHERE product_no = 1 OR product_no = 5;

query II rowsort
SELECT * FROM products;
----
1 8
3 200
5 12
7 8

statement ok
DROP INDEX idx1 ON products;

statement ok
UPDATE products SET price=800 WHERE product_no = 3;

query II rowsort
SELECT * FROM products;
----
1 8
3 800
5 12
7 8

query II
SELECT count(*) FROM products;
----
4

statement ok
UPDATE products SET price=price+3 WHERE product_no = 1 OR product_no = 5;

query II rowsort
SELECT * FROM products;
----
1 11
3 800
5 15
7 8

statement ok
DROP TABLE products;

statement ok
DROP TABLE IF EXISTS T2;

statement ok
CREATE TABLE T2 (c1 boolean, c2 boolean);

statement error
UPDATE t2 SET c1 = 1 WHERE c2 = true;

statement ok
DROP TABLE T2;

# Test UPDATE with NOT NULL constraint violation

statement ok
DROP TABLE IF EXISTS t_not_null;

statement ok
CREATE TABLE t_not_null (c1 INTEGER NOT NULL, c2 INTEGER);

statement ok
INSERT INTO t_not_null VALUES (1, 10);

statement error
UPDATE t_not_null SET c1 = NULL WHERE c1 = 1;

query I
SELECT * FROM t_not_null;
----
1 10

statement ok
UPDATE t_not_null SET c2 = NULL WHERE c1 = 1;

query I
SELECT * FROM t_not_null;
----
1 null

statement ok
DROP TABLE t_not_null;

statement ok
DROP TABLE IF EXISTS tbl1;

statement ok
CREATE TABLE tbl1(c1 EMBEDDING(int,2));

statement ok
INSERT INTO tbl1 (c1) VALUES ([1,2]), ([2,2]), ([3,2]);

statement ok
UPDATE tbl1 SET c1 = [10,20] WHERE 1 = 1;

query I rowsort
SELECT * FROM tbl1;
----
[10,20]
[10,20]
[10,20]

statement ok
DROP TABLE tbl1;
